<?xml version='1.0' encoding='utf-8'?>
<ClinicalDocument xmlns="urn:hl7-org:v3" xmlns:xsi="http://www.w3.org/2001/XMLSchema-instance" xmlns:dt="https://www.mhlw.go.jp/stf/seisakunitsuite/bunya/0000161103.html" xsi:schemaLocation="urn:hl7-org:v3 hc08_V08.xsd https://www.mhlw.go.jp/stf/seisakunitsuite/bunya/0000161103.html coreschemas/datatypes_hcgv08.xsd">
  <typeId root="2.16.840.1.113883.1.3" extension="POCD_HD000040"/>
  <id root="1.2.392.200119.6.1.4" extension="CDA_DOC_001"/>
  <code code="10" codeSystem="1.2.392.200119.6.1001" displayName="特定健診情報"/>
  <title>特定健診結果報告書</title>
  <effectiveTime value="20230510"/>
  <confidentialityCode code="N" codeSystem="2.16.840.1.113883.5.25"/>
  <languageCode code="ja-JP"/>
  <recordTarget>
    <patientRole>
      <id root="1.2.392.200119.6.201" extension="P001"/>
      <id root="1.2.392.200119.6.203" extension="INS001"/>
      <patient>
        <name>
          <dt:family>Tokutei</dt:family>
          <dt:given>Kenzo</dt:given>
        </name>
        <administrativeGenderCode code="Male" codeSystem="1.2.392.200119.6.1104"/>
        <birthTime value="19700101"/>
      </patient>
    </patientRole>
  </recordTarget>
  <author>
    <assignedAuthor>
      <id root="1.2.392.200119.6.102" extension="AUTH_HOSP"/>
    </assignedAuthor>
  </author>
  <custodian>
    <assignedCustodian>
      <representedCustodianOrganization>
        <id root="1.2.392.200119.6.102" extension="CUST_HOSP"/>
      </representedCustodianOrganization>
    </assignedCustodian>
  </custodian>
  <component typeCode="COMP">
    <structuredBody>
      <component>
        <section>
          <code/>
          <title>検査結果</title>
          <text>特定健診の検査結果を以下に示す。</text>
          <entry typeCode="DRIV">
            <observation classCode="OBS" moodCode="EVN">
              <code/>
              <value xsi:type="dt:PQ" value="170" unit="cm"/>
            </observation>
          </entry>
          <entry typeCode="DRIV">
            <observation classCode="OBS" moodCode="EVN">
              <code/>
              <value xsi:type="dt:PQ" value="65" unit="kg"/>
            </observation>
          </entry>
        </section>
      </component>
    </structuredBody>
  </component>
</ClinicalDocument>
