<?xml version='1.0' encoding='utf-8'?>
<ClinicalDocument xmlns="urn:hl7-org:v3" xmlns:xsi="http://www.w3.org/2001/XMLSchema-instance" xmlns:dt="https://www.mhlw.go.jp/stf/seisakunitsuite/bunya/0000161103.html" xsi:schemaLocation="urn:hl7-org:v3 hc08_V08.xsd https://www.mhlw.go.jp/stf/seisakunitsuite/bunya/0000161103.html coreschemas/datatypes_hcgv08.xsd">
  <typeId root="2.16.840.1.113883.1.3" extension="POCD_HD000040"/>
  <id root="" extension="CDA_DOC_002"/>
  <code code="" codeSystem="" displayName="特定健診情報"/>
  <title>特定健診結果報告書</title>
  <effectiveTime value="20230615"/>
  <confidentialityCode code="N" codeSystem="2.16.840.1.113883.5.25"/>
  <languageCode code="ja-JP"/>
  <recordTarget>
    <patientRole>
      <id root="" extension="P002"/>
      <id root="" extension="INS002"/>
      <patient>
        <name>
          <dt:family>Shido</dt:family>
          <dt:given>Hanako</dt:given>
        </name>
        <administrativeGenderCode code="Female" codeSystem=""/>
        <birthTime value="19850312"/>
      </patient>
    </patientRole>
  </recordTarget>
  <author>
    <assignedAuthor>
      <id root="" extension="AUTH_CLINIC"/>
    </assignedAuthor>
  </author>
  <custodian>
    <assignedCustodian>
      <representedCustodianOrganization>
        <id root="" extension="CUST_CLINIC"/>
      </representedCustodianOrganization>
    </assignedCustodian>
  </custodian>
  <documentationOf>
    <serviceEvent>
      <effectiveTime value="20230601"/>
    </serviceEvent>
  </documentationOf>
  <component typeCode="COMP">
    <structuredBody>
      <component>
        <section>
          <code code="01010" codeSystem="1.2.392.200119.6.1010" displayName="特定健診検査結果"/>
          <title>特定健診検査結果</title>
          <text>特定健診の検査結果を以下に示す。</text>
          <entry typeCode="DRIV">
            <observation classCode="OBS" moodCode="EVN">
              <code code="" codeSystem="" displayName="身長"/>
              <value xsi:type="dt:PQ" value="160" unit="cm"/>
            </observation>
          </entry>
          <entry typeCode="DRIV">
            <observation classCode="OBS" moodCode="EVN">
              <code code="" codeSystem="" displayName="体重"/>
              <value xsi:type="dt:PQ" value="55" unit="kg"/>
            </observation>
          </entry>
          <entry typeCode="DRIV">
            <observation classCode="OBS" moodCode="EVN">
              <code code="3" codeSystem="" displayName=""/>
              <value xsi:type="dt:CD" code="3" codeSystem="" displayName="不明"/>
            </observation>
          </entry>
        </section>
      </component>
    </structuredBody>
  </component>
</ClinicalDocument>
