<?xml version="1.0" encoding="UTF-8"?><ClinicalDocument xmlns="urn:hl7-org:v3" xmlns:xsi="http://www.w3.org/2001/XMLSchema-instance" xsi:schemaLocation="urn:hl7-org:v3 ../XSD/hc08_V08.xsd">  <!--   2021年度改訂対応ファイル produced by CC2CX2021  -->  <!--   ヘッダ情報記述部　-->  <!--CDAのデフォルト-->  <typeId root="2.16.840.1.113883.1.3" extension="POCD_HD000040"/>  <id nullFlavor="NI"/>  <!--報告区分コード -->  <code code="99999999" codeSystem="1.2.392.200119.6.1001"/>  <!--文書発行日（西暦）-->  <effectiveTime value="99999999"/>  <confidentialityCode code="N"/>  <!--受診者情報-->  <recordTarget>    <patientRole>      <!-- 保険者番号 -->      <id extension="99999999" root="1.2.392.200119.6.101"/>      <!-- 被保険者証等記号 -->      <id extension="99999999" root="1.2.392.200119.6.204"/>      <!-- 被保険者証等番号 -->      <id extension="99999999" root="1.2.392.200119.6.205"/>      <!-- 被保険者証等番号枝番 2021.02 -->      <id extension="99999999" root="1.2.392.200119.6.211"/>      <!--受診者 -->      <addr>        <postalCode>99999999</postalCode>				99999999			</addr>      <patient>        <name>99999999</name>        <!-- 性別 -->        <administrativeGenderCode code="99999999" codeSystem="1.2.392.200119.6.1104"/>        <!-- 生年月日 -->        <birthTime value="99999999"/>      </patient>    </patientRole>  </recordTarget>  <!--Author -->  <author>    <!-- 作成日 -->    <time value="99999999"/>    <assignedAuthor>      <id nullFlavor="NI"/>      <representedOrganization>        <!--作成機関のID番号 -->        <id extension="99999999" root="1.2.392.200119.6.102"/>        <!-- 作成機関名  -->        <name>99999999</name>        <telecom value="99999999"/>        <addr>          <postalCode>99999999</postalCode>					99999999					</addr>      </representedOrganization>    </assignedAuthor>  </author>  <custodian>    <assignedCustodian>      <representedCustodianOrganization>        <id nullFlavor="NI"/>      </representedCustodianOrganization>    </assignedCustodian>  </custodian>  <participant typeCode="HLD">    <!-- 受診券  -->    <functionCode code="1" codeSystem="1.2.392.200119.6.208"/>    <time>      <!--有効期限 -->      <high value="99999999"/>    </time>    <associatedEntity classCode="IDENT">      <!-- 番号 -->      <id extension="99999999" root="1.2.392.200119.6.209.99999999"/>      <!-- 保険者情報 -->      <scopingOrganization>        <!--保険者番号 -->        <id extension="99999999" root="1.2.392.200119.6.101"/>      </scopingOrganization>    </associatedEntity>  </participant>  <!--健診実施情報-->  <documentationOf>    <serviceEvent>      <!-- プログラム種別コード -->      <code code="99999999" codeSystem="1.2.392.200119.6.1002"/>      <!--実施日-->      <effectiveTime value="99999999"/>      <performer typeCode="PRF">        <assignedEntity>          <id nullFlavor="NI"/>          <representedOrganization>            <!--実施機関番号 -->            <id extension="99999999" root="1.2.392.200119.6.102"/>            <!-- 実施組織名 -->            <name>99999999</name>            <telecom value="99999999"/>            <addr>              <postalCode>99999999</postalCode>							99999999							</addr>          </representedOrganization>        </assignedEntity>      </performer>    </serviceEvent>  </documentationOf>  <!--   結果記述部 -->  <component>    <structuredBody>      <component>        <section>          <code code="99999999" codeSystem="1.2.392.200119.6.1010" displayName="99999999"/>          <title>99999999</title>          <text>            <list>              <item>99999999</item>            </list>          </text>          <!--[OBS]-->          <entry>            <observation classCode="OBS" moodCode="EVN">              <code code="99999999"/>            </observation>          </entry>        </section>      </component>    </structuredBody>  </component></ClinicalDocument>